{
  "format": "test-parrot/exam",
  "formatVersion": "0.4.0",
  "name": "Unit 3 Quiz",
  "sections": [
    {
      "title": "Warm-up",
      "instructions": "Circle the best answer."
    },
    {
      "title": "Short Answer",
      "instructions": ""
    },
    {
      "title": "Challenge",
      "instructions": "Answer each question. Read carefully."
    },
    {
      "title": "Extra Credit",
      "instructions": "Optional."
    }
  ],
  "headingSize": "large",
  "textSize": "small",
  "header": {
    "first": "Student: ____________  Period: ____"
  },
  "positions": [
    {
      "question": {
        "bank": "bank",
        "question": "q1"
      },
      "section": 0,
      "columns": 2
    },
    {
      "question": {
        "bank": "bank",
        "question": "q3"
      },
      "section": 0
    },
    {
      "question": {
        "bank": "bank",
        "question": "q5"
      },
      "section": 1
    },
    {
      "question": {
        "bank": "bank",
        "question": "q2"
      },
      "section": 2,
      "columns": 1
    },
    {
      "question": {
        "bank": "bank",
        "question": "q4"
      },
      "section": 2
    }
  ]
}
